{
  "$schema": "https://json-schema.org/draft/2020-12/schema",
  "$id": "https://datamodels.jp/schema/disaster/EvacuationShelter/v1.0.0.json",
  "title": "EvacuationShelter",
  "description": "Operational overlay for one evacuation shelter. The shelter master data (name, location) is not included; shelter links to it (DesignatedShelter), and externalShelterId / nationalShelterId identify it. Only opening status and evacuee counts live here. When the shelter is also a designated emergency evacuation site, site links to its EvacuationSite.",
  "x-version": "1.0.0",
  "x-license-url": "https://datamodels.jp/LICENSE-CONTENT",
  "x-model-tags": "disaster-response, Japan",
  "x-derived-from": "https://github.com/geolonia/geonicdb-datamodels",
  "type": "object",
  "properties": {
    "id": {
      "type": "string",
      "format": "uri",
      "description": "Entity id (URN)"
    },
    "type": {
      "type": "string",
      "const": "EvacuationShelter",
      "description": "Entity type"
    },
    "externalShelterId": {
      "description": "The shelter's ID in the municipality's 指定緊急避難場所一覧 (自治体標準オープンデータセット; unique within the municipality, e.g. CC0100022200). Together with localGovernmentCode it identifies the shelter nationwide",
      "type": "string",
      "x-ngsi": {
        "type": "Property"
      },
      "x-iri": "https://datamodels.jp/ns/disaster/externalShelterId"
    },
    "nationalShelterId": {
      "description": "全国共通避難所・避難場所ID (Cabinet Office SOBO-WEB / GSI 避難所等データ整備ウェブシステム): 14 characters, fixed 'E' + 5-digit municipality code + 5-digit facility code + type code (major '1' = designated shelter, the only value valid here; minor '1' = general shelter or '2' = welfare shelter) + 1 alphanumeric sequence starting at 1 (never 0). Optional: not every shelter has one assigned yet; omit the property entirely rather than send an empty string",
      "type": "string",
      "pattern": "^E[0-9]{10}1[12][1-9A-Za-z]$",
      "x-ngsi": {
        "type": "Property"
      },
      "x-iri": "https://datamodels.jp/ns/disaster/nationalShelterId"
    },
    "localGovernmentCode": {
      "description": "Local government code of the municipality that publishes the shelter list (全国地方公共団体コード, 6 digits)",
      "type": "string",
      "pattern": "^\\d{6}$",
      "x-ngsi": {
        "type": "Property"
      },
      "x-iri": "https://datamodels.jp/ns/common/localGovernmentCode"
    },
    "shelter": {
      "type": "string",
      "format": "uri",
      "description": "The designated shelter (DesignatedShelter) this operation record is for",
      "x-ngsi": {
        "type": "Relationship",
        "target": "https://datamodels.jp/ns/disaster/DesignatedShelter"
      },
      "x-iri": "https://datamodels.jp/ns/disaster/shelter"
    },
    "site": {
      "type": "string",
      "format": "uri",
      "description": "The designated emergency evacuation site (EvacuationSite) at the same place, when the shelter is also one",
      "x-ngsi": {
        "type": "Relationship",
        "target": "https://datamodels.jp/ns/disaster/EvacuationSite"
      },
      "x-iri": "https://datamodels.jp/ns/disaster/site"
    },
    "openingStatus": {
      "description": "Normalised opening state: open, closed, full (open but at capacity), requested (opening has been requested/instructed but is not yet confirmed open; no public code list defines this state, see statusLabel). The local wording always goes in statusLabel. When no value fits, leave it out and give the local wording in statusLabel",
      "type": "string",
      "enum": [
        "open",
        "closed",
        "full",
        "requested"
      ],
      "x-ngsi": {
        "type": "Property"
      },
      "x-iri": "https://datamodels.jp/ns/disaster/openingStatus"
    },
    "statusLabel": {
      "type": "string",
      "minLength": 1,
      "description": "The opening status in the local or source system's wording (e.g. 未開設, 開設中, 満員, 依頼中). Use this whenever the local wording has no exact match in openingStatus's enum. Required when openingStatus is left out",
      "x-ngsi": {
        "type": "Property"
      },
      "x-iri": "https://datamodels.jp/ns/task/statusLabel"
    },
    "evacueeHouseholds": {
      "description": "Number of evacuated households",
      "type": "integer",
      "x-ngsi": {
        "type": "Property"
      },
      "x-iri": "https://datamodels.jp/ns/disaster/evacueeHouseholds",
      "minimum": 0
    },
    "evacueeTotal": {
      "description": "Total number of evacuees",
      "type": "integer",
      "x-ngsi": {
        "type": "Property"
      },
      "x-iri": "https://datamodels.jp/ns/disaster/evacueeTotal",
      "minimum": 0
    },
    "evacueeFemale": {
      "description": "Number of female evacuees",
      "type": "integer",
      "x-ngsi": {
        "type": "Property"
      },
      "x-iri": "https://datamodels.jp/ns/disaster/evacueeFemale",
      "minimum": 0
    },
    "evacueeMale": {
      "description": "Number of male evacuees",
      "type": "integer",
      "x-ngsi": {
        "type": "Property"
      },
      "x-iri": "https://datamodels.jp/ns/disaster/evacueeMale",
      "minimum": 0
    },
    "description": {
      "type": "string",
      "description": "Free-text memo",
      "x-ngsi": {
        "type": "Property"
      },
      "x-iri": "https://uri.etsi.org/ngsi-ld/v1/ngsi-ld-core-context-v1.8.jsonld#description"
    },
    "openedAt": {
      "description": "Time the shelter opened",
      "type": "string",
      "format": "date-time",
      "x-ngsi": {
        "type": "Property"
      },
      "x-iri": "https://datamodels.jp/ns/disaster/openedAt"
    },
    "closedAt": {
      "description": "Time the shelter closed",
      "type": "string",
      "format": "date-time",
      "x-ngsi": {
        "type": "Property"
      },
      "x-iri": "https://datamodels.jp/ns/disaster/closedAt"
    }
  },
  "required": [
    "id",
    "type",
    "externalShelterId",
    "localGovernmentCode"
  ],
  "anyOf": [
    {
      "required": [
        "openingStatus"
      ]
    },
    {
      "required": [
        "statusLabel"
      ]
    }
  ],
  "additionalProperties": false
}
