{
  "id": "urn:ngsi-ld:EvacuationShelter:0012",
  "type": "EvacuationShelter",
  "externalShelterId": "13101-0012",
  "nationalShelterId": "E1310100012111",
  "localGovernmentCode": "131016",
  "shelter": "urn:ngsi-ld:DesignatedShelter:0012",
  "site": "urn:ngsi-ld:EvacuationSite:0012",
  "openingStatus": "open",
  "statusLabel": "開設中",
  "evacueeHouseholds": 12,
  "evacueeTotal": 30,
  "evacueeFemale": 16,
  "evacueeMale": 14,
  "description": "物資不足",
  "openedAt": "2026-07-08T09:00:00+09:00"
}
